{
  "schemaVersion": 1,
  "identity": {
    "id": "default-atmosphere",
    "name": "Default Atmosphere",
    "version": "1.0.0",
    "author": "cursor-skin",
    "description": "One image, one mood — code with atmosphere.",
    "preview": "preview.jpg",
    "tagline": "One image, one mood — code with atmosphere.",
    "brandSubtitle": "CURSOR SKIN"
  },
  "appearance": {
    "wallpaper": { "type": "image", "src": "wallpaper/main.jpg" },
    "baseTheme": "Cursor Dark",
    "scheme": "dark",
    "paletteId": "",
    "frost": { "enabled": true, "opacity": 0.4, "blur": 16 },
    "effects": { "glow": false, "vignette": false },
    "art": {
      "focusX": 0.72,
      "focusY": 0.4,
      "safeArea": "left",
      "taskMode": "ambient"
    }
  },
  "workspace": {
    "sidebar": { "surface": { "opacity": 0.42, "blur": 12 } },
    "editor": { "surface": { "opacity": 0.72, "blur": 4 }, "transparent": true },
    "chat": { "surface": { "opacity": 0.5, "blur": 10 }, "glass": true },
    "auxiliary": { "surface": { "opacity": 0.44, "blur": 12 } },
    "terminal": { "surface": { "opacity": 0.65, "blur": 8 }, "glass": true }
  },
  "performance": { "tier": "balanced" }
}
